Reading,Word,Category
ようがんしょうじゃいあんとはんどれっど,CNo.106 溶岩掌ジャイアント・ハンド・レッド,短縮よみ
じゃいあんとはんどれっど,CNo.106 溶岩掌ジャイアント・ハンド・レッド,短縮よみ
ようがんしょう,溶岩掌
ぎゃらくしーあいずたきおんどらごん,No.107 銀河眼の時空竜,短縮よみ
たきおんどらごん,No.107 銀河眼の時空竜,短縮よみ
たきおん,No.107 銀河眼の時空竜,サジェストのみ
ねおぎゃらくしーあいずたきおんどらごん,CNo.107 超銀河眼の時空龍,短縮よみ
ねおたきおん,CNo.107 超銀河眼の時空龍,サジェストのみ
むげんきょしんぬめろにあす,CNo.1000 夢幻虚神ヌメロニアス,短縮よみ
ぬめろにあす,CNo.1000 夢幻虚神ヌメロニアス,短縮よみ
むげんきょしん,夢幻虚神
むげんきょこうしんぬめろにあすぬめろにあ,CiNo.1000 夢幻虚光神ヌメロニアス・ヌメロニア,短縮よみ
ぬめろにあすぬめろにあ,CiNo.1000 夢幻虚光神ヌメロニアス・ヌメロニア,短縮よみ
むげんきょこうしん,夢幻虚光神
いんふぇくしょんばあるぜぶる,No.1 インフェクション・バアル・ゼブル,短縮よみ
ばあるぜぶる,No.1 インフェクション・バアル・ゼブル,短縮よみ
かがくにんじゃしゃどーもすきーと,No.2 蚊学忍者シャドー・モスキート,短縮よみ
しゃどーもすきーと,No.2 蚊学忍者シャドー・モスキート,短縮よみ
かがくにんじゃ,蚊学忍者
じごくぜみおうろーかすときんぐ,No.3 地獄蝉王ローカスト・キング,短縮よみ
ろーかすときんぐ,No.3 地獄蝉王ローカスト・キング,短縮よみ
じごくぜみおう,地獄蝉王
もうどくしほうすてるすくらーげん,No.4 猛毒刺胞ステルス・クラーゲン,短縮よみ
すてるすくらーげん,No.4 猛毒刺胞ステルス・クラーゲン,短縮よみ
もうどくしほう,猛毒刺胞
ほーぷぜある,SNo.0 ホープ・ゼアル,短縮よみ
みらいおうほーぷ,FNo.0 未来皇ホープ,短縮よみ
みらいおう,未来皇
みらいおうほーぷふゅーちゃーすらっしゅ,FNo.0 未来皇ホープ－フューチャー・スラッシュ,短縮よみ
ふゅーちゃーすらっしゅ,FNo.0 未来皇ホープ－フューチャー・スラッシュ,短縮よみ
みらいりゅうおうおーぷ,FNo.0 未来龍皇ホープ,短縮よみ
みらいりゅうおう,未来龍皇
みらいおうほーぷぜある,FNo.0 未来皇ホープ・ゼアル,短縮よみ
いんふぃにてぃだーくほーぷ,No.XX インフィニティ・ダークホープ,短縮よみ
だーくほーぷ,No.XX インフィニティ・ダークホープ,短縮よみ
じゅうそうがったいらいおほーぷれい,獣装合体 ライオ・ホープレイ,短縮よみ
らいおほーぷれい,獣装合体 ライオ・ホープレイ,短縮よみ
じゅうそうがったい,獣装合体
りゅうそうがったいどらごにっくほーぷれい,竜装合体 ドラゴニック・ホープレイ,短縮よみ
どらごにっくほーぷれい,竜装合体 ドラゴニック・ホープレイ,短縮よみ
りゅうそうがったい,竜装合体
きぼうおうばりあん,CX 冀望皇バリアン,短縮よみ
ばりあん,CX 冀望皇バリアン,短縮よみ
きぼうおう,冀望皇
ねふぃるあさいらむへっどないと,N・As・H Knight,短縮よみ
へっどないと,N・As・H Knight,短縮よみ
ねふぃるあさいらむかおすないと,CX－N・As・Ch Knight,短縮よみ
かおすないと,CX－N・As・Ch Knight,短縮よみ
ぜつぼうしんあんちほーぷ,絶望神アンチホープ
あんちほーぷ,絶望神アンチホープ,短縮よみ
ぜつぼうしん,絶望神
